--
-- FLOAT8
--
CREATE TEMP TABLE FLOAT8_TBL(f1 float);
INSERT INTO FLOAT8_TBL(f1) VALUES ('    0.0   ');
INSERT INTO FLOAT8_TBL(f1) VALUES ('1004.30  ');
INSERT INTO FLOAT8_TBL(f1) VALUES ('   -34.84');
INSERT INTO FLOAT8_TBL(f1) VALUES ('1.2345678901234e+200');
INSERT INTO FLOAT8_TBL(f1) VALUES ('1.2345678901234e-200');
-- test for underflow and overflow handling
SELECT '10e400'::float;
ERROR:  "10e400" is out of range for type double precision
LINE 1: SELECT '10e400'::float;
               ^
SELECT '-10e400'::float;
ERROR:  "-10e400" is out of range for type double precision
LINE 1: SELECT '-10e400'::float;
               ^
SELECT '10e-400'::float;
ERROR:  "10e-400" is out of range for type double precision
LINE 1: SELECT '10e-400'::float;
               ^
SELECT '-10e-400'::float;
ERROR:  "-10e-400" is out of range for type double precision
LINE 1: SELECT '-10e-400'::float;
               ^
-- bad input
INSERT INTO FLOAT8_TBL(f1) VALUES ('');
ERROR:  invalid input syntax for type double precision: ""
LINE 1: INSERT INTO FLOAT8_TBL(f1) VALUES ('');
                                           ^
INSERT INTO FLOAT8_TBL(f1) VALUES ('     ');
ERROR:  invalid input syntax for type double precision: "     "
LINE 1: INSERT INTO FLOAT8_TBL(f1) VALUES ('     ');
                                           ^
INSERT INTO FLOAT8_TBL(f1) VALUES ('xyz');
ERROR:  invalid input syntax for type double precision: "xyz"
LINE 1: INSERT INTO FLOAT8_TBL(f1) VALUES ('xyz');
                                           ^
INSERT INTO FLOAT8_TBL(f1) VALUES ('5.0.0');
ERROR:  invalid input syntax for type double precision: "5.0.0"
LINE 1: INSERT INTO FLOAT8_TBL(f1) VALUES ('5.0.0');
                                           ^
INSERT INTO FLOAT8_TBL(f1) VALUES ('5 . 0');
ERROR:  invalid input syntax for type double precision: "5 . 0"
LINE 1: INSERT INTO FLOAT8_TBL(f1) VALUES ('5 . 0');
                                           ^
INSERT INTO FLOAT8_TBL(f1) VALUES ('5.   0');
ERROR:  invalid input syntax for type double precision: "5.   0"
LINE 1: INSERT INTO FLOAT8_TBL(f1) VALUES ('5.   0');
                                           ^
INSERT INTO FLOAT8_TBL(f1) VALUES ('    - 3');
ERROR:  invalid input syntax for type double precision: "    - 3"
LINE 1: INSERT INTO FLOAT8_TBL(f1) VALUES ('    - 3');
                                           ^
INSERT INTO FLOAT8_TBL(f1) VALUES ('123           5');
ERROR:  invalid input syntax for type double precision: "123           5"
LINE 1: INSERT INTO FLOAT8_TBL(f1) VALUES ('123           5');
                                           ^
-- special inputs
SELECT 'NaN'::float;
 float 
--------
    NaN
(1 row)

SELECT 'nan'::float;
 float 
--------
    NaN
(1 row)

SELECT '   NAN  '::float;
 float 
--------
    NaN
(1 row)

SELECT 'infinity'::float;
  float  
----------
 Infinity
(1 row)

SELECT '          -INFINiTY   '::float;
  float   
-----------
 -Infinity
(1 row)

-- bad special inputs
SELECT 'N A N'::float;
ERROR:  invalid input syntax for type double precision: "N A N"
LINE 1: SELECT 'N A N'::float;
               ^
SELECT 'NaN x'::float;
ERROR:  invalid input syntax for type double precision: "NaN x"
LINE 1: SELECT 'NaN x'::float;
               ^
SELECT ' INFINITY    x'::float;
ERROR:  invalid input syntax for type double precision: " INFINITY    x"
LINE 1: SELECT ' INFINITY    x'::float;
               ^
SELECT 'Infinity'::float + 100.0;
 EXPR 
----------
 Infinity
(1 row)

SELECT 'Infinity'::float / 'Infinity'::float;
 EXPR 
----------
      NaN
(1 row)

SELECT 'nan'::float / 'nan'::float;
 EXPR 
----------
      NaN
(1 row)

SELECT 'nan'::numeric::float;
 float 
--------
    NaN
(1 row)

SELECT '' AS five, * FROM FLOAT8_TBL order by f1;
 five |          f1          
------+----------------------
      |               -34.84
      |                  0.0
      | 1.2345678901234e-200
      |               1004.3
      | 1.2345678901234e+200
(5 rows)

SELECT '' AS four, f.* FROM FLOAT8_TBL f WHERE f.f1 <> '1004.3' order by f1;
 four |          f1          
------+----------------------
      |               -34.84
      |                  0.0
      | 1.2345678901234e-200
      | 1.2345678901234e+200
(4 rows)

SELECT '' AS one, f.* FROM FLOAT8_TBL f WHERE f.f1 = '1004.3';
 one |   f1   
-----+--------
     | 1004.3
(1 row)

SELECT '' AS three, f.* FROM FLOAT8_TBL f WHERE '1004.3' > f.f1 order by f1;
 three |          f1          
-------+----------------------
       |               -34.84
       |                  0.0
       | 1.2345678901234e-200
(3 rows)

SELECT '' AS three, f.* FROM FLOAT8_TBL f WHERE  f.f1 < '1004.3' order by f1;
 three |          f1          
-------+----------------------
       |               -34.84
       |                  0.0
       | 1.2345678901234e-200
(3 rows)

SELECT '' AS four, f.* FROM FLOAT8_TBL f WHERE '1004.3' >= f.f1 order by f1;
 four |          f1          
------+----------------------
      |               -34.84
      |                  0.0
      | 1.2345678901234e-200
      |               1004.3
(4 rows)

SELECT '' AS four, f.* FROM FLOAT8_TBL f WHERE  f.f1 <= '1004.3' order by f1;
 four |          f1          
------+----------------------
      |               -34.84
      |                  0.0
      | 1.2345678901234e-200
      |               1004.3
(4 rows)

SELECT '' AS three, f.f1, f.f1 * '-10'::int AS x
   FROM FLOAT8_TBL f
   WHERE f.f1 > '0.0' order by f1 desc;
 three |          f1          |           x           
-------+----------------------+-----------------------
       | 1.2345678901234e+200 | -1.2345678901234e+201
       |               1004.3 |                -10043.0
       | 1.2345678901234e-200 | -1.2345678901234e-199
(3 rows)

SELECT '' AS three, f.f1, f.f1 + '-10'::int AS x
   FROM FLOAT8_TBL f
   WHERE f.f1 > '0.0' order by x desc;
 three |          f1          |          x           
-------+----------------------+----------------------
       | 1.2345678901234e+200 | 1.2345678901234e+200
       |               1004.3 |                994.3
       | 1.2345678901234e-200 |                  -10.0
(3 rows)

SELECT '' AS three, f.f1, f.f1 / '-10'::int AS x
   FROM FLOAT8_TBL f
   WHERE f.f1 > '0.0' order by x;
 three |          f1          |           x           
-------+----------------------+-----------------------
       | 1.2345678901234e+200 | -1.2345678901234e+199
       |               1004.3 |               -100.43
       | 1.2345678901234e-200 | -1.2345678901234e-201
(3 rows)

SELECT '' AS three, f.f1, f.f1 - '-10'::int AS x
   FROM FLOAT8_TBL f
   WHERE f.f1 > '0.0' order by x desc;
 three |          f1          |          x           
-------+----------------------+----------------------
       | 1.2345678901234e+200 | 1.2345678901234e+200
       |               1004.3 |               1014.3
       | 1.2345678901234e-200 |                   10.0
(3 rows)

SELECT '' AS one, f.f1 ^ ('2.0'::float) AS square_f1
   FROM FLOAT8_TBL f where f.f1 = '1004.3';
 one | square_f1  
-----+------------
     | 1008618.49
(1 row)

-- absolute value
SELECT '' AS five, f.f1, abs(f.f1) AS abs_f1
   FROM FLOAT8_TBL f order by abs_f1;
 five |          f1          |        abs_f1        
------+----------------------+----------------------
      |                    0.0 |                    0.0
      | 1.2345678901234e-200 | 1.2345678901234e-200
      |               -34.84 |                34.84
      |               1004.3 |               1004.3
      | 1.2345678901234e+200 | 1.2345678901234e+200
(5 rows)

-- truncate
SELECT '' AS five, f.f1, trunc(f.f1) AS trunc_f1
   FROM FLOAT8_TBL f order by f1;
 five |          f1          |       trunc_f1       
------+----------------------+----------------------
      |               -34.84 |                  -34
      |                    0 |                    0
      | 1.2345678901234e-200 |                    0
      |               1004.3 |                 1004
      | 1.2345678901234e+200 | 1.2345678901234e+200
(5 rows)

-- round
ISSUE[82] SELECT '' AS five, f.f1, round(f.f1) AS round_f1
   FROM FLOAT8_TBL f order by f1;
 five |          f1          |       round_f1       
------+----------------------+----------------------
      |               -34.84 |                  -35
      |                    0 |                    0
      | 1.2345678901234e-200 |                    0
      |               1004.3 |                 1004
      | 1.2345678901234e+200 | 1.2345678901234e+200
(5 rows)

-- ceil / ceiling
select ceil(f1) as ceil_f1 from float8_tbl f order by ceil_f1;
       ceil_f1        
----------------------
                  -34
                    0
                    1
                 1005
 1.2345678901234e+200
(5 rows)

select ceiling(f1) as ceiling_f1 from float8_tbl f order by ceiling_f1;
      ceiling_f1      
----------------------
                  -34
                    0
                    1
                 1005
 1.2345678901234e+200
(5 rows)

-- floor
select floor(f1) as floor_f1 from float8_tbl f order by floor_f1;
       floor_f1       
----------------------
                  -35
                    0
                    0
                 1004
 1.2345678901234e+200
(5 rows)

-- sign
select sign(f1) as sign_f1 from float8_tbl f order by sign_f1;
 sign_f1 
---------
      -1
       0
       1
       1
       1
(5 rows)

-- square root
SELECT sqrt(float '64') AS eight;
 eight 
-------
     8
(1 row)

NOTSUPPORTED SELECT |/ float '64' AS eight;
 eight 
-------
     8
(1 row)

NOTSUPPORTED SELECT '' AS three, f.f1, |/f.f1 AS sqrt_f1
   FROM FLOAT8_TBL f
   WHERE f.f1 > '0.0';
 three |          f1          |        sqrt_f1        
-------+----------------------+-----------------------
       |               1004.3 |      31.6906926399535
       | 1.2345678901234e+200 | 1.11111110611109e+100
       | 1.2345678901234e-200 | 1.11111110611109e-100
(3 rows)

-- power
SELECT power(float '144', float '0.5');
 power 
-------
    12
(1 row)

-- take exp of ln(f.f1)
ISSUE[82] SELECT '' AS three, f.f1, exp(ln(f.f1)) AS exp_ln_f1
   FROM FLOAT8_TBL f
   WHERE f.f1 > '0.0' order by f1;
 three |          f1          |       exp_ln_f1       
-------+----------------------+-----------------------
       | 1.2345678901234e-200 | 1.23456789012339e-200
       |               1004.3 |                1004.3
       | 1.2345678901234e+200 | 1.23456789012338e+200
(3 rows)

-- cube root
NOTSUPPORTED SELECT ||/ float '27' AS three;
 three 
-------
     3
(1 row)

NOTSUPPORTED SELECT '' AS five, f.f1, ||/f.f1 AS cbrt_f1 FROM FLOAT8_TBL f;
 five |          f1          |       cbrt_f1        
------+----------------------+----------------------
      |                    0 |                    0
      |               1004.3 |      10.014312837827
      |               -34.84 |    -3.26607421344208
      | 1.2345678901234e+200 | 4.97933859234765e+66
      | 1.2345678901234e-200 |  2.3112042409018e-67
(5 rows)

SELECT '' AS five, * FROM FLOAT8_TBL order by f1;
 five |          f1          
------+----------------------
      |               -34.84
      |                    0
      | 1.2345678901234e-200
      |               1004.3
      | 1.2345678901234e+200
(5 rows)

UPDATE FLOAT8_TBL
   SET f1 = FLOAT8_TBL.f1 * '-1'
   WHERE FLOAT8_TBL.f1 > '0.0';
ISSUE[82] SELECT '' AS bad, f.f1 * '1e200'::float from FLOAT8_TBL f;
ERROR:  value out of range: overflow
ISSUE[82] SELECT '' AS bad, f.f1 ^ '1e200'::float from FLOAT8_TBL f;
ERROR:  value out of range: overflow
SELECT 0 ^ 0 + 0 ^ 1 + 0 ^ 0.0 + 0 ^ 0.5;
 EXPR 
----------
        2
(1 row)

ISSUE[82] SELECT '' AS bad, ln(f.f1) from FLOAT8_TBL f where f.f1 = '0.0' ;
ERROR:  cannot take logarithm of zero
ISSUE[82] SELECT '' AS bad, ln(f.f1) from FLOAT8_TBL f where f.f1 < '0.0' ;
ERROR:  cannot take logarithm of a negative number
ISSUE[82] SELECT '' AS bad, exp(f.f1) from FLOAT8_TBL f;
ERROR:  value out of range: underflow
SELECT '' AS bad, f.f1 / '0.0' from FLOAT8_TBL f;
ERROR:  division by zero
SELECT '' AS five, * FROM FLOAT8_TBL order by f1 desc;
 five |          f1           
------+-----------------------
      |                     0
      | -1.2345678901234e-200
      |                -34.84
      |               -1004.3
      | -1.2345678901234e+200
(5 rows)

-- test for over- and underflow
ISSUE[82] INSERT INTO FLOAT8_TBL(f1) VALUES ('10e400');
ERROR:  "10e400" is out of range for type double precision
LINE 1: INSERT INTO FLOAT8_TBL(f1) VALUES ('10e400');
                                           ^
ISSUE[82] INSERT INTO FLOAT8_TBL(f1) VALUES ('-10e400');
ERROR:  "-10e400" is out of range for type double precision
LINE 1: INSERT INTO FLOAT8_TBL(f1) VALUES ('-10e400');
                                           ^
ISSUE[82] INSERT INTO FLOAT8_TBL(f1) VALUES ('10e-400');
ERROR:  "10e-400" is out of range for type double precision
LINE 1: INSERT INTO FLOAT8_TBL(f1) VALUES ('10e-400');
                                           ^
ISSUE[82] INSERT INTO FLOAT8_TBL(f1) VALUES ('-10e-400');
ERROR:  "-10e-400" is out of range for type double precision
LINE 1: INSERT INTO FLOAT8_TBL(f1) VALUES ('-10e-400');
                                           ^
-- maintain external table consistency across platforms
-- delete all values and reinsert well-behaved ones
DELETE FROM FLOAT8_TBL;
INSERT INTO FLOAT8_TBL(f1) VALUES ('0.0');
INSERT INTO FLOAT8_TBL(f1) VALUES ('-34.84');
INSERT INTO FLOAT8_TBL(f1) VALUES ('-1004.30');
INSERT INTO FLOAT8_TBL(f1) VALUES ('-1.2345678901234e+200');
INSERT INTO FLOAT8_TBL(f1) VALUES ('-1.2345678901234e-200');
SELECT '' AS five, * FROM FLOAT8_TBL order by f1 desc;
 five |          f1           
------+-----------------------
      |                     0
      | -1.2345678901234e-200
      |                -34.84
      |               -1004.3
      | -1.2345678901234e+200
(5 rows)
